{"challenger_max_drawdown_bps":380,"challenger_return_bps":1120,"challenger_strategy_id":"strat.trend.v2","champion_challenger_schema_version":1,"champion_max_drawdown_bps":420,"champion_return_bps":840,"champion_strategy_id":"strat.trend.v1","created_at":"2026-09-04T12:00:00Z","drift_detected":false,"evaluation_id":"eval.champ.trend-v1","evaluation_window_end":"2026-09-01T23:59:59Z","evaluation_window_start":"2026-06-01T00:00:00Z","information_ratio_diff_bps":45,"recommendation":"CONTINUE_SHADOW_MONITORING"}
